root@comp3134:~# tcpdump -n -i eth0 -c 5
tcpdump: verbose output suppressed, use -v or -vv for full protocol decode
listening on eth0, link-type EN10MB (Ethernet), capture size 262144 bytes
23:11:44.583456 IP 165.227.37.21.22 > 99.224.68.217.62260: Flags [P.], seq 1852745296:1852745404, ack 3145296269, win 501, length 108
23:11:44.583549 IP 165.227.37.21.22 > 99.224.68.217.62260: Flags [P.], seq 108:136, ack 1, win 501, length 28
23:11:44.583643 IP 165.227.37.21.22 > 99.224.68.217.62260: Flags [P.], seq 136:244, ack 1, win 501, length 108
23:11:44.583744 IP 165.227.37.21.22 > 99.224.68.217.62260: Flags [P.], seq 244:272, ack 1, win 501, length 28
23:11:44.583958 IP 165.227.37.21.22 > 99.224.68.217.62260: Flags [P.], seq 272:444, ack 1, win 501, length 172
5 packets captured
9 packets received by filter
0 packets dropped by kernel
